Amazon Customer,/gp/profile/amzn1.account.AGFNPO6QEYMNDSBMFUOR6PSX522Q,Product was gud,/gp/customer-reviews/R6B044HTHQPJ9?ASIN=B01LZKSVRB,"Delivery takes lot of time, apart from that product was gud."
Azam,/gp/profile/amzn1.account.AFPQOR2DYEFM7IRPFL3FJLSQU5XA,Go for it,/gp/customer-reviews/R39ZQV0KSOON96?ASIN=B01LZKSVRB,Good Product. Original packing. No issues from seller
Amazon Customer,/gp/profile/amzn1.account.AHWMWQGTBZDZMIVUEUUZNSBN4LJA,Battery not as good,/gp/customer-reviews/R14RD1L1DQB2GH?ASIN=B01LZKSVRB,Colour I like most
Jitender Kumar,/gp/profile/amzn1.account.AELZ3ZZJ7PE64SG7YIYHNOLVHJMQ,Small screen,/gp/customer-reviews/R1K7RSB4EVU5A0?ASIN=B01LZKSVRB,Screen are very small
suman singh,/gp/profile/amzn1.account.AEKZIWUXN5DCFB7A3Z44V4KPSSMQ,Four Stars,/gp/customer-reviews/R3DHIJTS04IT7V?ASIN=B01LZKSVRB,Product was good as expected
Suneel Parvathaneni,/gp/profile/amzn1.account.AGHICB3C2LDUZSZ3JBZKOVTEFQLA,Apple is excellent,/gp/customer-reviews/R316RJCY2JG35O?ASIN=B01LZKSVRB,"Apple iphone 7 is excellent phone, no other phone can beat it."
Amazon Customer,/gp/profile/amzn1.account.AHO7AHAUPHGE4EO4XKDDG6UHCDIQ,Five Stars,/gp/customer-reviews/R19Z9P2R6VAK08?ASIN=B01LZKSVRB,Happy and satisfied
durgesh0319sb,/gp/profile/amzn1.account.AFYVIGIWP2A23MRDLFFYKGULMX5A,My phone Iphone ♥️,/gp/customer-reviews/R1YK7T95ZOTM94?ASIN=B01LZKSVRB,"Best Ph ever, fully satisfied with the ph n service aswell."
R.Priya,/gp/profile/amzn1.account.AHIJGLC3SKZCRTB5RC627KDLWOZQ,"good qulaity, great sound",/gp/customer-reviews/R12TXFR0QY6IC1?ASIN=B01LZKSVRB,i really liked this Product 1 phone 7 my best choice. Good product.
Amazon Customer,/gp/profile/amzn1.account.AEI353E4TPM7O5TVQTR47HB6FREQ,Five Stars,/gp/customer-reviews/R36ADI3RANXAOO?ASIN=B01LZKSVRB,Amazing product and delivery is vey fast
Shivam,/gp/profile/amzn1.account.AGNU67WGX7XLKHDINTAMLHCHA4SA,Go for it,/gp/customer-reviews/R2RTKIOEVURFM1?ASIN=B01LZKSVRB,"Just amazing, if the price is 35k than we should get 64 gb at least"
Vipin Menon,/gp/profile/amzn1.account.AGZRKGU2RR7VQ3LIZBOULVUU7CDA,OK Phone,/gp/customer-reviews/R1NJZNADUTI5O?ASIN=B01LZKSVRB,Its good
Rohit Shinde,/gp/profile/amzn1.account.AFKTMW4DQ4EI46UFKC4W4P6ZTJYA,Superb product,/gp/customer-reviews/R2FLZFTU37A494?ASIN=B01LZKSVRB,Got very cheap in great Indian sale
bhadra,/gp/profile/amzn1.account.AGF5POXSXDFQEAOH2L2RJQFP4UMQ,Five Stars,/gp/customer-reviews/R2HTQHJAS9PNZI?ASIN=B01LZKSVRB,I m satisfied with the product and delivery
Divay,/gp/profile/amzn1.account.AGC6TQERROK2KSUHKGW6NAAXPWDQ,Temperature issues,/gp/customer-reviews/R35H21IIQV9K17?ASIN=B01LZKSVRB,All is ok but it get extremely hot while playing games.
anilkumar,/gp/profile/amzn1.account.AEEXZQAEBVVPBGOD5KSLVCMFBDHQ,Five Stars,/gp/customer-reviews/R3CVW0FJQ25OZ7?ASIN=B01LZKSVRB,Migrated to IOS really loved it
saina,/gp/profile/amzn1.account.AFK24OSGDHTUKMZNC7R2CIKFTJLA,Five Stars,/gp/customer-reviews/R37IV454QZLZ61?ASIN=B01LZKSVRB,I juz ❤️ iPhone and thank you amazon😘
Vijay Dulipala,/gp/profile/amzn1.account.AFZCAWI3IYKVO6B7YPFJN7JVYAQQ,Ok,/gp/customer-reviews/R2XOZ2V73NIBZM?ASIN=B01LZKSVRB,I got a defective earphones set :( which is not working
VIvek Sukumar,/gp/profile/amzn1.account.AFQF6Y2RG4BHMKEWCAKHWAIUTP5Q,Five Stars,/gp/customer-reviews/R3STCOXE6O7WBX?ASIN=B01LZKSVRB,Good so far
apoorv kaushal,/gp/profile/amzn1.account.AGET2EBU2QTSNERMTJ6ZXHXGP7OA,Five Stars,/gp/customer-reviews/R1UEK66WZGGW8Q?ASIN=B01LZKSVRB,Thanx for the best deal for iphone 7.
Upendar pamu,/gp/profile/amzn1.account.AHZSDPGQHUAZLW2BQQUGY6XVUEGA,Five Stars,/gp/customer-reviews/R5W18XBALRC0H?ASIN=B01LZKSVRB,very fast delivery i can say its just awsme
Aman Ahuja,/gp/profile/amzn1.account.AEEXSORIEHJ7HP4SGQVGIHXCMGFQ,Best phone,/gp/customer-reviews/R2BXOIIFN1EQ97?ASIN=B01LZKSVRB,Hater gonna hate but it’s the bestest phone
Amazon Customer,/gp/profile/amzn1.account.AHBK4D522QSYYNZBSDOBLWNU3M2A,Heating Up Issue,/gp/customer-reviews/R39QO7QX859V0C?ASIN=B01LZKSVRB,This product is getting heated up frequently. I am doubting product’s authenticity now.
Azhar Saiyed,/gp/profile/amzn1.account.AEAZAUUXR2FH6GLV3Q6U6QDF6JEQ,Apple Lovers,/gp/customer-reviews/R1JMO8A6NHZAY9?ASIN=B01LZKSVRB,Can’t go wrong with Apple!
Pardeep Singh ,/gp/profile/amzn1.account.AERSZOW5NLV3LUVIBQH6NAWH2CZA,Recommended,/gp/customer-reviews/R859MMPYNDQGU?ASIN=B01LZKSVRB,Fully genuine apple product
Rajesh Sarkar,/gp/profile/amzn1.account.AGWV7VVY5TZPXYNT73DDTH6DHXFQ,Some time it’s work slow,/gp/customer-reviews/RN7XPQ7M7QMB6?ASIN=B01LZKSVRB,It’s the best phone ever
Neelam j.,/gp/profile/amzn1.account.AEUIQ4HKFF5OB2C4WFQUCJMUIJRQ,Five Stars,/gp/customer-reviews/R3T97HTK7B25QO?ASIN=B01LZKSVRB,Working osam loved the phone and giving the best price
adithya sridhar,/gp/profile/amzn1.account.AGSMTII45ADSZS7O4UBTOZWZD66Q,Excellent,/gp/customer-reviews/R17RATPQ8K63RJ?ASIN=B01LZKSVRB,Excellent
Amazon Customer,/gp/profile/amzn1.account.AF3Z7PAHUOKAIRDWL5H7G5QNG5CA,"Nice product, original product delivered I am",/gp/customer-reviews/R2VLHYFXLVKJ3?ASIN=B01LZKSVRB,"Nice product , original product delivered I am happy"
RAJESH G.,/gp/profile/amzn1.account.AETW57T3VLRXZHQEMYHFX3AF4OKQ,Amazing mobile fully satisfied,/gp/customer-reviews/R36SDO2XIC3RSX?ASIN=B01LZKSVRB,Amazing mobile no hang problems no heating good camera feature.superb out finishing
Kiran s.,/gp/profile/amzn1.account.AEYCBD55G5SGFU73ZFMKJUYGJEAQ,Great experience,/gp/customer-reviews/R2ME30R6OOVTTZ?ASIN=B01LZKSVRB,iPhone 😍 loved it
Amazon Customer,/gp/profile/amzn1.account.AGUDKCIYFW5M34FAWDZDHABW7FNQ,Five Stars,/gp/customer-reviews/R3ELT0QMEVNN4A?ASIN=B01LZKSVRB,Am happy with the whole experience.
Amazon Customer,/gp/profile/amzn1.account.AHYUWKKZB25EZKJF3XSFWJ5M2UNQ,The vibration feature of the phone is not working so ...,/gp/customer-reviews/R2DU2WGOT6EZKT?ASIN=B01LZKSVRB,The vibration feature of the phone is not working so I hv to get that fixed or return the phone
Sourabh,/gp/profile/amzn1.account.AHW4JGYRGI6ZTUPMMCB5OOAJTRKQ,Duplicate charger,/gp/customer-reviews/R340S44ZCJYPVS?ASIN=B01LZKSVRB,Charger provided with phone is not original
Deepak Singh,/gp/profile/amzn1.account.AH5QI7NRHZ6HXYLHE2X4KOBGUXPA,Four Stars,/gp/customer-reviews/RBXEZ83N1EGLL?ASIN=B01LZKSVRB,Everything is good but phone delivered to me in 7days
Giri,/gp/profile/amzn1.account.AHSK7WNJRLC3RJBEVXEIKE3VXIDA,Five Stars,/gp/customer-reviews/R1ZFKVFA6UML1R?ASIN=B01LZKSVRB,Need Bill copy to my mail id
Sudhanshu Rana,/gp/profile/amzn1.account.AEFCDRLVZR3N3HHYBLVHUZKKZFEQ,Nice deal,/gp/customer-reviews/R1L101AKCZHHXN?ASIN=B01LZKSVRB,Nice deal
Amazon Customer,/gp/profile/amzn1.account.AEE5FOKRTXZRQMOC2M3LTQKWWUHA,Five Stars,/gp/customer-reviews/R45B54IQWC71D?ASIN=B01LZKSVRB,Best product Best Price......!!!😊
Kiran,/gp/profile/amzn1.account.AHTV4UADU2KRHTUKOCEMG2EDPWGQ,Nice experience overall!,/gp/customer-reviews/RCH018M7NSVJW?ASIN=B01LZKSVRB,Amazon delivered the product one day early. Very nice product!
ANBU,/gp/profile/amzn1.account.AGIEAYMLCJL6TQFCYH44I3AOMCMQ,Five Stars,/gp/customer-reviews/R2QHB9OTRF3OF7?ASIN=B01LZKSVRB,Delivery was fast and phone was delivered as per spec.
Raghu s,/gp/profile/amzn1.account.AFENUNUZ4MDFTK2AN7TDRMBMVQOQ,Battery,/gp/customer-reviews/R1JZSI2HGNUXZ?ASIN=B01LZKSVRB,Nice product but battery life could have been better
Vinod kumar ,/gp/profile/amzn1.account.AHV4GD2SO3446DEV3OSQ7WXLKGZQ,Battery back up is not good,/gp/customer-reviews/R1XBSPDYN4TJQ6?ASIN=B01LZKSVRB,Battery back up is not good
Smart Buyer,/gp/profile/amzn1.account.AF6XAPGAT6MJNDDF3JI3IW2S5IQQ,Five Stars,/gp/customer-reviews/R6FSKKBF0H5F2?ASIN=B01LZKSVRB,"Prompt Delivery and Original iPhone, completely satisfied"
Prince Chaudhary ,/gp/profile/amzn1.account.AFMLCHZ3HGJTR7UXQLJHVCX7INWA,Five Stars,/gp/customer-reviews/R1KR18617XE79Q?ASIN=B01LZKSVRB,Loving the product 😍
Manoj P Selva,/gp/profile/amzn1.account.AHN47DVUSMNMWKMVO34K7VIETACQ,Kudos Amazon,/gp/customer-reviews/R36EWEGJEYFRT6?ASIN=B01LZKSVRB,Genuine product. Excellent customer service from Amazo.
Amazon Customer,/gp/profile/amzn1.account.AE7HOAXV2VPCUNMYWH4MOP7VJJ4A,craziest iPhone apple have ever made,/gp/customer-reviews/R1XYUJNDKAPIAT?ASIN=B01LZKSVRB,LIT af🔥
Amazon Customer,/gp/profile/amzn1.account.AFGPVYN3IKYQKBRJEECSLUX74WDQ,Five Stars,/gp/customer-reviews/R3H84R02J5L57W?ASIN=B01LZKSVRB,its iPhone.  Enough said
Kishan Mishra,/gp/profile/amzn1.account.AEBJSLASUUVQAI6SHJL24FAQY45Q,🍎,/gp/customer-reviews/R1NSWJTPOEB3LM?ASIN=B01LZKSVRB,Apple is Apple.
Sushant karjee,/gp/profile/amzn1.account.AHCA4DEJQACYMUDNYGUPZTWATYHA,Five Stars,/gp/customer-reviews/R1622OYT75IUNF?ASIN=B01LZKSVRB,Good phone but colour is not so good because logo never seen and phone is always looks unclean/dirty
Raghav Bhagat,/gp/profile/amzn1.account.AFRMBW3I4JBIR7O4LENQFNJJDGYQ,Five Stars,/gp/customer-reviews/R1T789GRE2GN5L?ASIN=B01LZKSVRB,Awesome product. Quick shipping.
Arnab Mukherjee,/gp/profile/amzn1.account.AEJONIDZKFYFCING4RKAMTV6OY3A,Perfect,/gp/customer-reviews/R2K22IXVFMDHHL?ASIN=B01LZKSVRB,"As any other apple, just perfect."
Amazon Customer,/gp/profile/amzn1.account.AHAXL7WSLLNTUGSJ5KA75GURJL3A,Miss the headphone jack,/gp/customer-reviews/RJYQZH1WCDWRH?ASIN=B01LZKSVRB,"that's it, only one flaw with Iphone7."
Ajaykumar,/gp/profile/amzn1.account.AFJPY3MAO5S2HN2NRDNRWS7W6HOQ,Five Stars,/gp/customer-reviews/R11DAR9JRDJH1C?ASIN=B01LZKSVRB,Super phone
Siddharth Sharma 😊,/gp/profile/amzn1.account.AFDS3K23ZXUGINOQX23ZP2STAWRA,This is really goooooooood,/gp/customer-reviews/RUH2X6UOI2C6H?ASIN=B01LZKSVRB,Just 👍🏻👍🏻👍🏻👍🏻👍🏻👍🏻👍🏻
Vamsi krishna,/gp/profile/amzn1.account.AFLO62SE5FQCBVMI4W5NQCK4YDFA,.,/gp/customer-reviews/R36QFNEZQHB58R?ASIN=B01LZKSVRB,Best
Sachin Penkar,/gp/profile/amzn1.account.AEQDB7LPYOZLVIDBIPIDDWZCI7ZA,Five Stars,/gp/customer-reviews/R1SEF8OJD40PX3?ASIN=B01LZKSVRB,meets expectations.. just missed back button initially but now m used to this phone :)
Subhajit Pathak,/gp/profile/amzn1.account.AHRO6L6SEFIISNO6C66L5GUQ32YQ,Five Stars,/gp/customer-reviews/R1L3RQK8REJ9GL?ASIN=B01LZKSVRB,Excellent Product...
Amazon Customer,/gp/profile/amzn1.account.AHYJSXVEZBUZLAM6YRXISOOFTKCA,Five Stars,/gp/customer-reviews/R3BA6VGFJ7UF9V?ASIN=B01LZKSVRB,Fantastick
Tanbir A.,/gp/profile/amzn1.account.AFUHY54TWWO3UNXAHCMG4KRGYZ4A,No value for money,/gp/customer-reviews/R232H8FPV3609D?ASIN=B01LZKSVRB,Not as expected. The phone get heated up while charging.
Umedsingh Shekhawat,/gp/profile/amzn1.account.AFAFJ3OREDZVWU26WBJKJN7GWDAQ,Five Stars,/gp/customer-reviews/R2FHA72HSCH4JK?ASIN=B01LZKSVRB,Excellent Product !
Amazon Customer,/gp/profile/amzn1.account.AFGHMDAEJ52ZLPJRAOSPK2QQNPSQ,nice product totally genuine,/gp/customer-reviews/RO364ZH7KRNUP?ASIN=B01LZKSVRB,nice product
Ganesh,/gp/profile/amzn1.account.AGJMOVUDU442XK5VS7K7DNZCG6OQ,The Phone is just awesome,/gp/customer-reviews/R2JHDI3IZSDYCO?ASIN=B01LZKSVRB,No need to write reviews.. The Phone is just awesome
Emabel Sequeira,/gp/profile/amzn1.account.AEZPCLLLIAAT23JE2WXJV4TGLCMQ,Five Stars,/gp/customer-reviews/RBEIVSEJYKGG6?ASIN=B01LZKSVRB,Exellent!
Prakhar ,/gp/profile/amzn1.account.AGLXOK5U4PU5RN37SLLZYW7PALDA,Five Stars,/gp/customer-reviews/R25B7NV3GOMLM5?ASIN=B01LZKSVRB,100% original iPhone.
Jasdeep brar,/gp/profile/amzn1.account.AEIIEPATOQB7ST3ND3UFGAGTQETQ,Superb apple as always,/gp/customer-reviews/RCVDLQ9QR4MXU?ASIN=B01LZKSVRB,Superb apple
dhanya,/gp/profile/amzn1.account.AHGHV63WLRCYKFOK2H3KIZAWPF4A,Four Stars,/gp/customer-reviews/R3V5HMHUHZZM61?ASIN=B01LZKSVRB,It's good
Amazon Customer,/gp/profile/amzn1.account.AEHOPZJ55UJUGDUJMNJAI5MGM2PA,Four Stars,/gp/customer-reviews/R24H2F6REG8FLW?ASIN=B01LZKSVRB,Awesome mobile but more cost.
Amazon Customer,/gp/profile/amzn1.account.AFKK2G62QZ7MDOL45ZPCU4LTIEKA,Five Stars,/gp/customer-reviews/R25SX5W0Z1JZ6N?ASIN=B01LZKSVRB,Amazing !!!
Prashant chauhan,/gp/profile/amzn1.account.AFTJKT7OI2M6HL3HQEYD7UTYJQ4A,everything is fantastic,/gp/customer-reviews/R2E0HBKQ0UAEMK?ASIN=B01LZKSVRB,Everything is fantastic..
Amazon Customer,/gp/profile/amzn1.account.AGAT6KWGEGGUNHMP2TBCKURCMQJA,Four Stars,/gp/customer-reviews/R14TISUV2NV6LP?ASIN=B01LZKSVRB,"Package is not so what i expected , But arrive at time and no harm in package ! good"
deepa lama,/gp/profile/amzn1.account.AGKZ2AZPUAX7OR77HZIF3Q5ANPXA,Awesome phone,/gp/customer-reviews/R1QI3WL8XPUQAQ?ASIN=B01LZKSVRB,It is one of the best phones I purchased online...
Keerthi L,/gp/profile/amzn1.account.AGEHZENJRYQ4M4U3Y7FJLBXXZP6A,Good,/gp/customer-reviews/R3A972HF8DXF6J?ASIN=B01LZKSVRB,Good
Amazon Customer,/gp/profile/amzn1.account.AHNFF7S3GE7NVQWS42G2OTHF6C3Q,Five Stars,/gp/customer-reviews/R3MRG8VISCET6B?ASIN=B01LZKSVRB,Its apple what rest needed👍🏻
Amazon Customer,/gp/profile/amzn1.account.AFRSWOUK7N44CHZNF44ON6P3TBLQ,Five Stars,/gp/customer-reviews/R1RGWP41UOWZLQ?ASIN=B01LZKSVRB,It is good product
Amazon Customer,/gp/profile/amzn1.account.AHWIPCDSUTG5ZVE3CAH6UIS3GLOA,Five Stars,/gp/customer-reviews/R3J3FAX1JEHNUH?ASIN=B01LZKSVRB,Nice
vamshi v.,/gp/profile/amzn1.account.AFLRQO3SOMXJRWL74EAJEVHKT7RQ,Overall good experience,/gp/customer-reviews/R5XD1WT6D3CG5?ASIN=B01LZKSVRB,It's a good buy considering the price range I got it for
prajapati jaymin,/gp/profile/amzn1.account.AFUUORUCO5H53MU4ZPIIN5G6T2IQ,Five Stars,/gp/customer-reviews/R9SKJLVGOTR0A?ASIN=B01LZKSVRB,It is dream mobile phone
Mahenoor bashir,/gp/profile/amzn1.account.AH65L7DVQMDGGUDTU3J3OZTXZGNA,Five Stars,/gp/customer-reviews/R1XJNSL125T45K?ASIN=B01LZKSVRB,Best👍🏻...
Amazon Customer,/gp/profile/amzn1.account.AFVI35Z5VX3VPVM2KA4OU4AHEZDA,Liked it as usual,/gp/customer-reviews/R3NEDLMB10QVZG?ASIN=B01LZKSVRB,Good
Amazon Customer,/gp/profile/amzn1.account.AHWPZ4SYT7LOKHII7ESAYAVZMEFA,Every thing as expected,/gp/customer-reviews/R17ZQPL22QES0N?ASIN=B01LZKSVRB,Nice phone. Every thing as expected.
Shahid Ahmed,/gp/profile/amzn1.account.AEOIIVHB5RPAKZURIGMJJ3Y2UCGQ,Five Stars,/gp/customer-reviews/R23KIFV2BT0Z8X?ASIN=B01LZKSVRB,It’s IPhone no need words...
Amazon Customer,/gp/profile/amzn1.account.AH23CYPX5BQQMZRZRZIP46ZI6M3Q,Awesome,/gp/customer-reviews/R22BFNVEP8K3AH?ASIN=B01LZKSVRB,iphone is Awesome
Sapna dixit,/gp/profile/amzn1.account.AEVSXT4BJW4KMN2LA5VVS3UWNHWA,Not gud pbone,/gp/customer-reviews/R25GPRCNFDU51K?ASIN=B01LZKSVRB,Heating problem.
KAPIL,/gp/profile/amzn1.account.AH73Z745POYB5QOPGYC6ZRDCT4SQ,Five Stars,/gp/customer-reviews/RWDSAV0DG68P0?ASIN=B01LZKSVRB,Money Matter
Amazon Customer,/gp/profile/amzn1.account.AEM3LDZT7XMM7DBSAFYK4FT6EZTQ,4⭐️,/gp/customer-reviews/R2OMCXFNRRCT6L?ASIN=B01LZKSVRB,4⭐️
Amazon Customer,/gp/profile/amzn1.account.AESMBFJHSLSQ2CYSRLPFRG7BJRQQ,Five Stars,/gp/customer-reviews/R36Q0A6EF6E541?ASIN=B01LZKSVRB,Best Smartphone always.  Thanks to zestmoney and Amazon
ashok,/gp/profile/amzn1.account.AGYQQZA3VTDBEK7F3Z5RX2NK6BSQ,Nice,/gp/customer-reviews/R37QYIDT91SI56?ASIN=B01LZKSVRB,Good
Sushil Bobade,/gp/profile/amzn1.account.AGQ65PT3JWU234I3S6Y33BMQXSYA,Awesome,/gp/customer-reviews/R31YIG3CBMQ118?ASIN=B01LZKSVRB,"I phone is handy, touch and feel of iPhone is awesome"
Nishant Bhardwaj ,/gp/profile/amzn1.account.AHHTU5ZWMMXLFALM5XVX5PHNY2BQ,iPhone 7 Nice Phone 👌👍,/gp/customer-reviews/R28PDM3TP44CKD?ASIN=B01LZKSVRB,"Picture quality,sound and battery all are too good"
Amazon Customer,/gp/profile/amzn1.account.AGOHKBX7TL5RFPM25K5SW2QMHH7A,Five Stars,/gp/customer-reviews/R3CKVF2ZKW31NJ?ASIN=B01LZKSVRB,Excellent phone!
Arvind,/gp/profile/amzn1.account.AESAT7DIMABAYYF2QA6EAIAYRR4A,Four Stars,/gp/customer-reviews/R1UT1V5M8H7D48?ASIN=B01LZKSVRB,Amazing phone. Battery drain earlier than expected.
Debraj S Choudhury,/gp/profile/amzn1.account.AEAKCPE6D47B3XU5IIJOSDC5M6DA,So far it’s very good.,/gp/customer-reviews/R104D94OOM3O1X?ASIN=B01LZKSVRB,Today is my second day with the device. So far it’s very good.
Aditya Reddy,/gp/profile/amzn1.account.AENBNHOFWDDVOSSVT2SCSMLKK5JQ,Five Stars,/gp/customer-reviews/R2DSH55EZ604HS?ASIN=B01LZKSVRB,phone is good delivery is faster than we expect .
Arindam Haldar,/gp/profile/amzn1.account.AGQI4ZJXHXI7A6FA2GCFB6CNOLPA,Five Stars,/gp/customer-reviews/R36R4Z84KX0HTN?ASIN=B01LZKSVRB,"timely delivery, outstanding product"
SHARDENDU SINGH,/gp/profile/amzn1.account.AEEHZMGRZWBCSYTP4TSX4755OMCA,Four Stars,/gp/customer-reviews/R33SKQK2KBWE9Z?ASIN=B01LZKSVRB,Gud phone with gud prise.
Joseph Kumar M,/gp/profile/amzn1.account.AGCTTOB73T7Y34Y232MZKAIKX3QA,Five Stars,/gp/customer-reviews/R2LQNLF2ZNB0VO?ASIN=B01LZKSVRB,Awesome.
Krsna :-),/gp/profile/amzn1.account.AFVT5UJQ3NGOQRGGSI2EBPGDSIBA,Good,/gp/customer-reviews/R2Y40M9SCLQ0TY?ASIN=B01LZKSVRB,Good
prashant singhal,/gp/profile/amzn1.account.AES5D2E4BOJCYUCIRA23GFMMGMJQ,Fast delivery with excellent product.,/gp/customer-reviews/RB15JHQ2BGEVU?ASIN=B01LZKSVRB,Fast delivery with excellent product.
Kuldeep Tiwari kst-onlinedotcom,/gp/profile/amzn1.account.AE3MB77CMQWEIDSP53X7G74J4DDA,Expect Cash back its good !,/gp/customer-reviews/R26RM680GD8Y2R?ASIN=B01LZKSVRB,Its awesome !! Great  but still  waiting for cash back i didn't received tht amount detail yet !.
Dr. S.,/gp/profile/amzn1.account.AEAYV3PCGWUNJ6BQ476VJRI62NIQ,Nice product,/gp/customer-reviews/R2G7F5QE9IIUR1?ASIN=B01LZKSVRB,35% discount for 256gb... aaahhh dem good men.
Amazon Customer,/gp/profile/amzn1.account.AF6VJ2E7VEQY2STZBGASBOSPLWAQ,Very good prodcut,/gp/customer-reviews/R10HSGJ8XPW9ZP?ASIN=B01LZKSVRB,Phone is nice and very good experience
Ujjwal Bhatia,/gp/profile/amzn1.account.AHRLUY32OQY7GCS7TNETEWGKZXBA,Earphones adapter not received,/gp/customer-reviews/R37N5KN14SAJSJ?ASIN=B01LZKSVRB,I didn't receive earphone adapter in this set.😠😠😡😡
Pratiek,/gp/profile/amzn1.account.AFENM6TTGUFCAAF4NWGZMOOPSS4A,Five Stars,/gp/customer-reviews/RU3HS1GJTR75G?ASIN=B01LZKSVRB,Nice Phone... Camera Quality Is Best...
s.k.karpe,/gp/profile/amzn1.account.AF27WTU5S2J4PRORWAYGGP63DR7Q,Good product,/gp/customer-reviews/R42JYRR6TO06E?ASIN=B01LZKSVRB,Camera quality is very good.
Nilesh Patel,/gp/profile/amzn1.account.AG6RGOBO2WOK4USNSHZ6DP2UWGJA,Five Stars,/gp/customer-reviews/R2MDR1CTADRBME?ASIN=B01LZKSVRB,Product Very Good...
gurpreet singh,/gp/profile/amzn1.account.AELREI5W44GH5WSH7JB6AANSNNFQ,Five Stars,/gp/customer-reviews/R3R9LIH5ONMT6G?ASIN=B01LZKSVRB,nice product...
ViSHNU R RAj,/gp/profile/amzn1.account.AEKXW7V4LUSLGFGBA6RNXA6HOTGA,Awesome service from Amazon and rocket kommerce LLP,/gp/customer-reviews/R26R2AN4MCT4VV?ASIN=B01LZKSVRB,It's an apple I lov it  good phone from the seller the package as discribed
Dk,/gp/profile/amzn1.account.AHIVKNDSMLF42M2KEUOJHS3VQUAQ,Excellent,/gp/customer-reviews/R1LQQK66J70RCU?ASIN=B01LZKSVRB,Like
Lalitha. R.,/gp/profile/amzn1.account.AHFL7ASHUBO5CPDWSO5EQDQS2GRA,iPhone is iPhone,/gp/customer-reviews/R3NEYHM0XOEOC8?ASIN=B01LZKSVRB,Is great to use
Sandeep Choudhary ,/gp/profile/amzn1.account.AFRCZEJSSDVYF74YCINJ6HTBJDVQ,Excellent,/gp/customer-reviews/R10YMXLYFNGK3R?ASIN=B01LZKSVRB,Apple always gives priority to security and latest technology
Dillip Swain,/gp/profile/amzn1.account.AHE3KD4PGEYZD75GCHIACNELLWWA,Mobile is so good But battery is not good Battery backup achi nehi,/gp/customer-reviews/RU4VBSBGKPS7V?ASIN=B01LZKSVRB,Mobile is so good
shubham kaushik,/gp/profile/amzn1.account.AHMJMAFICH7ACPXOUF37KGHFH2UA,Superb 🤘,/gp/customer-reviews/RUBE3EGMFUK2D?ASIN=B01LZKSVRB,Superb condition superb phone 🤘🤭
Amazon Customer,/gp/profile/amzn1.account.AGOCOHW5NG35ZM3GOAV7CVD6SWQQ,Wooowwww....,/gp/customer-reviews/R2FNF3LE7SW5AU?ASIN=B01LZKSVRB,Best in world...Simply awesome
manvendra singh,/gp/profile/amzn1.account.AGQ5E3NKC5CVCI5BB3ULVSAZ5QVQ,smooth glossy fast slim smart,/gp/customer-reviews/R1AUBWHJVMHL8R?ASIN=B01LZKSVRB,iPhone is iPhone. smooth glossy fast slim smart
Ankit Kumar,/gp/profile/amzn1.account.AFCZELHKHINV3UM6Z2JHVYADQ3LA,Five Stars,/gp/customer-reviews/R2E95Q86VQTX2D?ASIN=B01LZKSVRB,Amazing iPhone
Saumya,/gp/profile/amzn1.account.AGQAQMHZRDAZ43F3THPESYXIZEAA,Five Stars,/gp/customer-reviews/R2AS2SDQA4BQQC?ASIN=B01LZKSVRB,Lovely phone!
Amazon Customer,/gp/profile/amzn1.account.AFO4KEYFMYODKMO2EDNNGN67EI3A,Five Stars,/gp/customer-reviews/R258V6EUW3VJ9B?ASIN=B01LZKSVRB,Excellent Phone
umang kumar,/gp/profile/amzn1.account.AHMSUHSNNHNIQIJ2CIBIEXAGYE2Q,Excellent phone delivered on time!!!,/gp/customer-reviews/R3RE60G5BBKKYD?ASIN=B01LZKSVRB,Excellent phone delivered on time!!!
Amazon Customer,/gp/profile/amzn1.account.AHKPHBHVEB2MD2RYQI2TJYZ6OV3A,Great product,/gp/customer-reviews/R2HSQZEF2PNB7?ASIN=B01LZKSVRB,Great product
divanshu gupta,/gp/profile/amzn1.account.AFLVCPFYFX3NS6FEFFWUWHZ6O6DQ,Five Stars,/gp/customer-reviews/R3FECKE42PXWBO?ASIN=B01LZKSVRB,BEST PRODUCT AND FAST DELIVERY BY AMAZON
Sumit P.,/gp/profile/amzn1.account.AEKKSGFWPCLXSW74MHLD2LPEWQ3A,Five Stars,/gp/customer-reviews/RWKTXCODJA14G?ASIN=B01LZKSVRB,its awesome..i love it..
thumma abhinay reddy,/gp/profile/amzn1.account.AGH6ZXYVRNQMPZOVCDLLLKLISRMQ,Superb colour and looking grt,/gp/customer-reviews/R310HXSVS4V6ZZ?ASIN=B01LZKSVRB,It’s i-phone yar don’t need any reviews 😉
Dakarapu,/gp/profile/amzn1.account.AFR6V7I6NYW63XCZOOI7X5ESG52Q,Five Stars,/gp/customer-reviews/RRRZKU9OVQD3C?ASIN=B01LZKSVRB,Quick delivery as expected and the product was sealed
NAGARJUNA.S,/gp/profile/amzn1.account.AGA5PG6AUFD6KPKS6CKXZ556MVCA,Excellent,/gp/customer-reviews/R25ODILTSYWWUQ?ASIN=B01LZKSVRB,Nice product
Danish patel,/gp/profile/amzn1.account.AETMFMMG2J654PFJWUMACBANJI7A,A very good phone,/gp/customer-reviews/R1VWP0GQNMBCR7?ASIN=B01LZKSVRB,Battery life could have been better
Manish Kumar Sharma,/gp/profile/amzn1.account.AHZ7UKUV5W653BU2YXVA2ZLWEGNA,Quality is not good,/gp/customer-reviews/R16V8AIN7LFBIA?ASIN=B01LZKSVRB,"Quality is not good, i want to return this product."
Diki Doma Bhutia,/gp/profile/amzn1.account.AEWZH5WU3PSGABJ57NMX5VSLKN2Q,Very good,/gp/customer-reviews/R2SSZXQM1AOX40?ASIN=B01LZKSVRB,Till now it is well functioning
Amazon Customer,/gp/profile/amzn1.account.AFNMCR2YUEN5VAEFUNJB5FCTWRVA,Mind blowing purchase,/gp/customer-reviews/RGG1Q04VB2N3M?ASIN=B01LZKSVRB,Superb camera quality.Thank you amazon
Arun Kumar,/gp/profile/amzn1.account.AHT25N7IDZOFMN3O65MQIJY2TGXQ,Five Stars,/gp/customer-reviews/R1LL5EHCTALDZ9?ASIN=B01LZKSVRB,Good product
umakant,/gp/profile/amzn1.account.AFZSRRZOJTOJA4C7U5NE34RHOABQ,Nice,/gp/customer-reviews/R3ILF4WB3GJVU1?ASIN=B01LZKSVRB,Nice
Amazon Customer,/gp/profile/amzn1.account.AFQBECQCM345PA27QMGMHY2EVGAA,Five Stars,/gp/customer-reviews/R1LGTAD498DG8I?ASIN=B01LZKSVRB,Good product
nikesh patel,/gp/profile/amzn1.account.AEHBOP6R37QY26KDU2HF5FIWCCLQ,Four Stars,/gp/customer-reviews/R1XKYDEJ2YXI2S?ASIN=B01LZKSVRB,"yes its nice genuine phone, all was good on receipt of phone"
Priyanka Sharma,/gp/profile/amzn1.account.AE555JLO6HZQOIXKZPJ62E65NF6A,Five Stars,/gp/customer-reviews/RHFICHQFCMEIE?ASIN=B01LZKSVRB,Amazing phone 😍😍😍
Amazon Customer,/gp/profile/amzn1.account.AGAKCZ54TQI4VC7RFMPOGGQQX2BA,Amazing product !!!,/gp/customer-reviews/R28OCZQO9PRXXA?ASIN=B01LZKSVRB,super
Varun Soni,/gp/profile/amzn1.account.AGYXMQUZHC2PYIX6O4HA4NGBJBHA,Good,/gp/customer-reviews/RO8RE7AXBIPCH?ASIN=B01LZKSVRB,Good
Vaibhav B.,/gp/profile/amzn1.account.AF7FWS54QVLLOIM7LP6XKF2PGRRQ,"Bro, seriously",/gp/customer-reviews/R3GRFW0NZU5OFA?ASIN=B01LZKSVRB,Nothing to tell just amazing
Amazon Customer,/gp/profile/amzn1.account.AFVUVPJUHRR667DJY54FHRWWQSIA,Five Stars,/gp/customer-reviews/R28MIFV085DH8O?ASIN=B01LZKSVRB,Excellent 😍
M Dutta,/gp/profile/amzn1.account.AF2OUQ4BHNLBBL5BE7EMUTKPZ7TQ,Five Stars,/gp/customer-reviews/ROW185ZK7LILU?ASIN=B01LZKSVRB,Great phone
UMESH K,/gp/profile/amzn1.account.AEUSELW3TIO7O5HIXXVVJPPXY57A,Good,/gp/customer-reviews/R15LMBAVL1A5LX?ASIN=B01LZKSVRB,Good
sanjay,/gp/profile/amzn1.account.AHUZ4F3OLMBIPPFXPIKJIVMVQGAQ,Five Stars,/gp/customer-reviews/R1IFO5GEL3ANEO?ASIN=B01LZKSVRB,Awesome :)
chaitanyavarma alluri,/gp/profile/amzn1.account.AEHKKHCNW4QYJWXZM2DHVJKL372Q,Send a copy of bill,/gp/customer-reviews/RDI1ZVK5Y1H78?ASIN=B01LZKSVRB,I Get an damaged bill please send an copy of bill
virendra vyas,/gp/profile/amzn1.account.AEOADGAXGLK5JHV6ZEVSWGAGQZUA,Three Stars,/gp/customer-reviews/R18J6QA5LTPP9B?ASIN=B01LZKSVRB,One of the best
javedshaikh,/gp/profile/amzn1.account.AFRZBKZUOMVE2E7UPP4CHLAPBCZA,Five Stars,/gp/customer-reviews/R3LQPEK4ND8VTH?ASIN=B01LZKSVRB,Awesome....genuine product
Abhinav m.,/gp/profile/amzn1.account.AGKREZQNRDEGDL6RHODX6RMP4R5A,Five Stars,/gp/customer-reviews/R3NL9G9K48TVE8?ASIN=B01LZKSVRB,its awesome ...still a good cam....
Amazon Customer,/gp/profile/amzn1.account.AECNIKEPYO4Y5FZWIFK3XM3AO3DQ,Five Stars,/gp/customer-reviews/R2QSB7DEEY323T?ASIN=B01LZKSVRB,Great product 👍
Vinay Mylarappa,/gp/profile/amzn1.account.AFACWCXAMVZBD2JQEO7EEA7OMCQQ,Perfect Phone,/gp/customer-reviews/RJR1GROIEE34C?ASIN=B01LZKSVRB,Fast and good battery life
Rishi,/gp/profile/amzn1.account.AGVPWGBMUS6GHF7I4WQ4MASXH6JA,About complain,/gp/customer-reviews/R3V8IFO2BCAQZX?ASIN=B01LZKSVRB,Adaptor (charger) damage in only 8 days. Very bad product..
P.Malthi,/gp/profile/amzn1.account.AE7H2L7NRHO6ILVVN4HME6S3EXSQ,Excellent iphone,/gp/customer-reviews/R1FF2QTKONP7W8?ASIN=B01LZKSVRB,Good phone
Amazon Customer,/gp/profile/amzn1.account.AHMSGRIPUFQB7J4TUSMC7AWN3SFQ,all good so,/gp/customer-reviews/R20H7BP4D5MBSB?ASIN=B01LZKSVRB,"Delivered an hour early, all good so far"
Skywalker,/gp/profile/amzn1.account.AHOPKY2YUHKD3GLCGE3XLCSSFRGA,Excellent,/gp/customer-reviews/REWQCH944YL05?ASIN=B01LZKSVRB,Thanks amazon for very fast delivery. Phone is very fast and beautiful works very smoothly
Bhavana s.,/gp/profile/amzn1.account.AFKTIFBVTMBOK3O7RWWTACPRIFGA,Four Stars,/gp/customer-reviews/R37QUGYK1I2VHZ?ASIN=B01LZKSVRB,I love it
